{
  "version": "1.0.0",
  "generated_for_role": "direccion_general",
  "data_as_of": "2026-07-08T14:56:34-06:00",
  "read_only": true,
  "source_of_truth": "docs/pc/PC_CLOSURE_TRACKER.md",
  "role_gate": {
    "is_gated": true,
    "gate": "PEND-NOMINALES",
    "reason": "Contenido sensible de Dirección requiere usuarios nominales antes de exposición (cuenta compartida direccion@)."
  },
  "modules": [
    {
      "id": "plan_vs_real",
      "name": "Plan vs Real",
      "description": "Comparar ruta planeada vs ejecutada (km / paradas / tiempo).",
      "badge": "piloto",
      "badge_label": "Piloto",
      "badge_tone": "teal",
      "source": "gf.route.plan (vistas MVP1.5A)",
      "link_kind": "metabase_or_status",
      "roles": [
        "direccion_general",
        "gerente_sucursal",
        "supervisor_ventas"
      ],
      "can_not": [
        "recalcular",
        "publicar",
        "optimizar",
        "escribir"
      ],
      "residual": "km real limitado (D-KM-FALLBACK); adopción general no medida",
      "tracker_ref": "MVP1.5A / PC#14",
      "last_evidence": "MVP1.5A cierre técnico [P]",
      "owner": "Sebastián"
    },
    {
      "id": "rentabilidad",
      "name": "Rentabilidad",
      "description": "Margen por ruta/cliente (ingreso vs costo).",
      "badge": "parcial",
      "badge_label": "Parcial",
      "badge_tone": "amber",
      "source": "liquidación + costos + km",
      "link_kind": "metabase",
      "roles": [
        "direccion_general",
        "finanzas"
      ],
      "can_not": [
        "tomar dato no consolidado como verdad",
        "escribir"
      ],
      "residual": "km real limitado; consignación dedup pendiente (PC#12 -> E5); cash pending",
      "tracker_ref": "PC#12",
      "last_evidence": "PC#12 técnico [P]",
      "owner": "Sebastián/Finanzas"
    },
    {
      "id": "adopcion",
      "name": "Adopción",
      "description": "Uso real de cada capacidad (checklist, POD, B2B, refill).",
      "badge": "parcial",
      "badge_label": "Parcial",
      "badge_tone": "amber",
      "source": "conteos Odoo por feature",
      "link_kind": "status",
      "roles": [
        "direccion_general",
        "admin_plataforma"
      ],
      "can_not": [
        "inferir adopción alta donde es baja",
        "escribir"
      ],
      "residual": "checklist 18/10; B2B pwa_b2b ~0; POD employee ~100% reciente",
      "tracker_ref": "PC#4/#6/#7",
      "last_evidence": "PC#4/#6/#7 [R]",
      "owner": "Sebastián"
    },
    {
      "id": "control_radar",
      "name": "Control / Radar",
      "description": "Salud de módulos y alertas de estado (no telemetría viva).",
      "badge": "piloto",
      "badge_label": "Piloto",
      "badge_tone": "teal",
      "source": "tracker + estado de módulos",
      "link_kind": "status",
      "roles": [
        "direccion_general",
        "admin_plataforma"
      ],
      "can_not": [
        "tomar como monitoreo en tiempo real",
        "escribir"
      ],
      "residual": "es status curado, no telemetría",
      "tracker_ref": "acta E0",
      "last_evidence": "acta E0 [V]",
      "owner": "Claude/Sebastián"
    },
    {
      "id": "koldhome_b2c",
      "name": "KoldHome Tower (B2C)",
      "description": "Funnel / estado retail B2C.",
      "badge": "parcial",
      "badge_label": "Parcial",
      "badge_tone": "amber",
      "source": "funnel.event / koldhome_v4_dashboard",
      "link_kind": "metabase_embed",
      "roles": [
        "direccion_general",
        "comercial"
      ],
      "can_not": [
        "leer como operación completa",
        "escribir"
      ],
      "residual": "Control Tower Fase 1; depende de Sebás aplicar SQL/réplica; embed gated (D-METABASE)",
      "tracker_ref": "iniciativa control-tower (fuera de los 15 PC)",
      "last_evidence": "doc control-tower [P]",
      "owner": "Sebastián"
    },
    {
      "id": "glaciem_b2b",
      "name": "Glaciem Tower (B2B)",
      "description": "Control multicanal de ventas Glaciem.",
      "badge": "pc",
      "badge_label": "En clasificación",
      "badge_tone": "gray",
      "source": "gf.sales.channel, v_glaciem_*",
      "link_kind": "metabase_embed",
      "roles": [
        "direccion_general",
        "comercial"
      ],
      "can_not": [
        "tratar como cerrado",
        "escribir"
      ],
      "residual": "doc maestro espera /goal Fase 1/2; embed gated (D-METABASE)",
      "tracker_ref": "iniciativa glaciem (fuera de los 15 PC)",
      "last_evidence": "doc glaciem [P]",
      "owner": "Sebastián"
    },
    {
      "id": "estado_modulos_pc",
      "name": "Estado de módulos / PC",
      "description": "Mapa real del sistema (semáforo E0), curado por rol.",
      "badge": "operativo",
      "badge_label": "Operativo",
      "badge_tone": "green",
      "source": "PC_CLOSURE_TRACKER curado por rol",
      "link_kind": "status",
      "roles": [
        "direccion_general",
        "admin_plataforma"
      ],
      "can_not": [
        "exponer tracker crudo (evidencia/riesgos internos)",
        "escribir"
      ],
      "residual": "curación por rol obligatoria (DEC-E1-SCOPE-MIN)",
      "tracker_ref": "PC_CLOSURE_TRACKER (documental)",
      "last_evidence": "acta E0 GREEN15 [V]",
      "owner": "Claude"
    },
    {
      "id": "backlog_cierre",
      "name": "Backlog / cierre",
      "description": "Control de rutas sin cerrar (control instalado, no liquidado).",
      "badge": "piloto",
      "badge_label": "Piloto",
      "badge_tone": "teal",
      "source": "gf.route.plan states + cortes",
      "link_kind": "status",
      "roles": [
        "direccion_general",
        "gerente_sucursal"
      ],
      "can_not": [
        "leer como backlog liquidado",
        "escribir"
      ],
      "residual": "histórico NO liquidado; rollout owners pendiente",
      "tracker_ref": "PC#13",
      "last_evidence": "corte Iguala [R]",
      "owner": "Angélica (IGU34)/Yamil"
    }
  ]
}
